{
  "schema_version": "1.0.0",
  "manifest_id": "src-mediqa2019-32311a1",
  "dataset_name": "abachaa/MEDIQA2019",
  "primary_url": "https://github.com/abachaa/MEDIQA2019",
  "immutable_revision": "32311a139b583a9ccec133b3f8a21873d4ff3561",
  "artifact": {
    "upstream_path": "git archive 32311a139b583a9ccec133b3f8a21873d4ff3561",
    "retrieved_at": "2026-08-31T00:00:00Z",
    "byte_size": 14735360,
    "sha256": "4a2690a6bb973e32c016c2039e18f4c0831588959adae31d6a9d510320110b18",
    "local_storage_uri": "file:///Users/ppluton/Documents/ChatGPT/Medical_train_llm/data/raw/mediqa2019"
  },
  "license": {
    "identifier": "CC-BY-4.0",
    "url": "https://creativecommons.org/licenses/by/4.0/",
    "attribution_required": true,
    "restrictions": [
      "Preserve attribution to MEDIQA 2019 and its cited ACL-BioNLP publication.",
      "Exclude Task 1 MedNLI unless separate PhysioNet access and governance are approved."
    ]
  },
  "citation": "Ben Abacha A, Shivade C, Demner-Fushman D. Overview of the MEDIQA 2019 Shared Task on Textual Inference, Question Entailment and Question Answering. ACL-BioNLP 2019.",
  "admission_status": "candidate",
  "pre_ingestion_checks": {
    "provenance": "passed",
    "license": "passed",
    "pii": "manual_review_required",
    "format": "passed",
    "duplicates": "manual_review_required",
    "split_leakage": "manual_review_required"
  },
  "notes": [
    "Task 2 RQE and Task 3 QA are acquired; controlled Task 1 MedNLI is absent.",
    "Canonical inventory contains 9,120 RQE pairs, 383 QA questions, and 3,042 answers.",
    "MEDIQA labels measure entailment or QA relevance, not triage priority.",
    "A deterministic 70-question Presidio sample passed, but it is not a full-corpus scan."
  ]
}
